___________________________________________________________________

	UC1 Create Database of Address Book.
___________________________________________________________________


mysql> create database Address_Book_Service;
Query OK, 1 row affected (0.04 sec)


mysql> show databases;
+----------------------+
| Database             |
+----------------------+
| address_book_service |
| information_schema   |
| mysql                |
| payroll_service      |
| performance_schema   |
| sakila               |
| sys                  |
| world                |
+----------------------+
8 rows in set (0.01 sec)


mysql> use address_book_service;
Database changed




___________________________________________________________________

	UC2 Create Table of Address Book.
___________________________________________________________________



mysql> create table address_book (id serial primary key, fname varchar(255) not null ,lname varchar(255) not null ,address varchar(255),city varchar(255) not null, state varchar(255) not null ,zip long not null ,phone long  not null, email varchar(255));
Query OK, 0 rows affected (0.10 sec)

mysql> desc address_book;
+---------+-----------------+------+-----+---------+----------------+
| Field   | Type            | Null | Key | Default | Extra          |
+---------+-----------------+------+-----+---------+----------------+
| id      | bigint unsigned | NO   | PRI | NULL    | auto_increment |
| fname   | varchar(255)    | NO   |     | NULL    |                |
| lname   | varchar(255)    | NO   |     | NULL    |                |
| address | varchar(255)    | YES  |     | NULL    |                |
| city    | varchar(255)    | NO   |     | NULL    |                |
| state   | varchar(255)    | NO   |     | NULL    |                |
| zip     | mediumtext      | NO   |     | NULL    |                |
| phone   | mediumtext      | NO   |     | NULL    |                |
| email   | varchar(255)    | YES  |     | NULL    |                |
+---------+-----------------+------+-----+---------+----------------+
9 rows in set (0.01 sec)




___________________________________________________________________

	UC3 Insert data in tables.
___________________________________________________________________




 Insert into address_book(fname,lname,address,city,state,zip,phone,email) values("Vedant","Gujarathi","Gujarathi Lane","Chopda","Maharashtra",425107,9145526100,"vedantgujarathi22@gmail.com");
Query OK, 1 row affected (0.03 sec)


mysql> Insert into address_book(fname,lname,address,city,state,zip,phone,email) values ("Tushar","Jadhav","Asalfa","Mumbai","Maharashtra",421078,9400121022,"tusharjadhav21gmail.com");
Query OK, 1 row affected (0.00 sec)


mysql> Insert into address_book(fname,lname,address,city,state,zip,phone,email) values ("Sayali","Kurhade","Nerul","Mumbai","Maharashtra",425405,9910120019,"SayaliKurhade20gmail.com");
Query OK, 1 row affected (0.01 sec)


mysql> Insert into address_book(fname,lname,address,city,state,zip,phone,email) values ("Vaibhav","Kumbhar","Govandi","Mumbai","Maharashtra",425210,9910124214,"VaibhavKumbhar19gmail.com");
Query OK, 1 row affected (0.01 sec)


mysql> Insert into address_book(fname,lname,address,city,state,zip,phone,email) values ("Vedant","Jain","sector 22 Bhopal","Bhopal","Madhyapradesh",425107,7400441210,"VedantJain18gmail.com");
Query OK, 1 row affected (0.01 sec)



mysql> select * from address_book
    -> ;
+----+---------+-----------+------------------+--------+---------------+--------+------------+-----------------------------+
| id | fname   | lname     | address          | city   | state         | zip    | phone      | email                       |
+----+---------+-----------+------------------+--------+---------------+--------+------------+-----------------------------+
|  1 | Vedant  | Gujarathi | Gujarathi Lane   | Chopda | Maharashtra   | 425107 | 9145526100 | vedantgujarathi22@gmail.com |
|  2 | Tushar  | Jadhav    | Asalfa           | Mumbai | Maharashtra   | 421078 | 9400121022 | tusharjadhav21gmail.com     |
|  3 | Sayali  | Kurhade   | Nerul            | Mumbai | Maharashtra   | 425405 | 9910120019 | SayaliKurhade20gmail.com    |
|  4 | Vaibhav | Kumbhar   | Govandi          | Mumbai | Maharashtra   | 425210 | 9910124214 | VaibhavKumbhar19gmail.com   |
|  5 | Vedant  | Jain      | sector 22 Bhopal | Bhopal | Madhyapradesh | 425107 | 7400441210 | VedantJain18gmail.com       |
+----+---------+-----------+------------------+--------+---------------+--------+------------+-----------------------------+
5 rows in set (0.00 sec)



___________________________________________________________________

	UC4 Update data by name of contact.
___________________________________________________________________



mysql> select * from address_book;
+----+---------+-----------+------------------+---------+---------------+--------+------------+-----------------------------+
| id | fname   | lname     | address          | city    | state         | zip    | phone      | email                       |
+----+---------+-----------+------------------+---------+---------------+--------+------------+-----------------------------+
|  1 | Vedant  | Gujarathi | Gujarathi Lane   | Chopda  | Maharashtra   | 425107 | 9145526100 | vedantgujarathi22@gmail.com |
|  2 | Tushar  | Jadhav    | Asalfa           | Mumbai  | Maharashtra   | 421078 | 9400121022 | tusharjadhav21gmail.com     |
|  3 | Sayali  | Kurhade   | Nerul            | Mumbai  | Maharashtra   | 425405 | 9910120019 | SayaliKurhade20gmail.com    |
|  4 | Vaibhav | Kumbhar   | Govandi          | Mumbai  | Maharashtra   | 425210 | 9910124214 | VaibhavKumbhar19gmail.com   |
|  5 | Vedant  | Jain      | sector 22 Bhopal | Bhopal  | Madhyapradesh | 425107 | 7400441210 | VedantJain18gmail.com       |
|  6 | Kanchan | Mahajan   | Shaitan Galli    | Bhuswal | Maharashtra   | 425107 | 7305441242 | KanchanMahajan17gmail.com   |
+----+---------+-----------+------------------+---------+---------------+--------+------------+-----------------------------+
6 rows in set (0.00 sec)


mysql> update address_book set fname = "Nikita",lname = "patil",address = "Shaitan Galli,Shamshan ke samne",city = "Chalisgoan",state = "Maharashtra",zip ="425107" ,phone = "6235610812",email = "NiktaPatil21@gmail.com" where fname = "Kanchan" ;
Query OK, 1 row affected (0.02 sec)
Rows matched: 1  Changed: 1  Warnings: 0



mysql> select * from address_book;
+----+---------+-----------+---------------------------------+------------+---------------+--------+------------+-----------------------------+
| id | fname   | lname     | address                         | city       | state         | zip    | phone      | email                       |
+----+---------+-----------+---------------------------------+------------+---------------+--------+------------+-----------------------------+
|  1 | Vedant  | Gujarathi | Gujarathi Lane                  | Chopda     | Maharashtra   | 425107 | 9145526100 | vedantgujarathi22@gmail.com |
|  2 | Tushar  | Jadhav    | Asalfa                          | Mumbai     | Maharashtra   | 421078 | 9400121022 | tusharjadhav21gmail.com     |
|  3 | Sayali  | Kurhade   | Nerul                           | Mumbai     | Maharashtra   | 425405 | 9910120019 | SayaliKurhade20gmail.com    |
|  4 | Vaibhav | Kumbhar   | Govandi                         | Mumbai     | Maharashtra   | 425210 | 9910124214 | VaibhavKumbhar19gmail.com   |
|  5 | Vedant  | Jain      | sector 22 Bhopal                | Bhopal     | Madhyapradesh | 425107 | 7400441210 | VedantJain18gmail.com       |
|  6 | Nikita  | patil     | Shaitan Galli,Shamshan ke samne | Chalisgoan | Maharashtra   | 425107 | 6235610812 | NiktaPatil21@gmail.com      |
+----+---------+-----------+---------------------------------+------------+---------------+--------+------------+-----------------------------+
6 rows in set (0.00 sec)




___________________________________________________________________

	UC5 Delete data by name of contact.
___________________________________________________________________



mysql> delete from address_book where fname = "Nikita";
Query OK, 1 row affected (0.02 sec)

mysql> select * from address_book;
+----+---------+-----------+------------------+--------+---------------+--------+------------+-----------------------------+
| id | fname   | lname     | address          | city   | state         | zip    | phone      | email                       |
+----+---------+-----------+------------------+--------+---------------+--------+------------+-----------------------------+
|  1 | Vedant  | Gujarathi | Gujarathi Lane   | Chopda | Maharashtra   | 425107 | 9145526100 | vedantgujarathi22@gmail.com |
|  2 | Tushar  | Jadhav    | Asalfa           | Mumbai | Maharashtra   | 421078 | 9400121022 | tusharjadhav21gmail.com     |
|  3 | Sayali  | Kurhade   | Nerul            | Mumbai | Maharashtra   | 425405 | 9910120019 | SayaliKurhade20gmail.com    |
|  4 | Vaibhav | Kumbhar   | Govandi          | Mumbai | Maharashtra   | 425210 | 9910124214 | VaibhavKumbhar19gmail.com   |
|  5 | Vedant  | Jain      | sector 22 Bhopal | Bhopal | Madhyapradesh | 425107 | 7400441210 | VedantJain18gmail.com       |
+----+---------+-----------+------------------+--------+---------------+--------+------------+-----------------------------+
5 rows in set (0.00 sec)



___________________________________________________________________

	UC6  Retriving data by city and state of contact.
___________________________________________________________________




mysql> select * from address_book where city = "chopda";

+----+--------+-----------+----------------+--------+-------------+--------+------------+-----------------------------+
| id | fname  | lname     | address        | city   | state       | zip    | phone      | email                       |
+----+--------+-----------+----------------+--------+-------------+--------+------------+-----------------------------+
|  1 | Vedant | Gujarathi | Gujarathi Lane | Chopda | Maharashtra | 425107 | 9145526100 | vedantgujarathi22@gmail.com |
+----+--------+-----------+----------------+--------+-------------+--------+------------+-----------------------------+
1 row in set (0.00 sec)



mysql> select * from address_book where state = "Madhyapradesh";

+----+--------+-------+------------------+--------+---------------+--------+------------+-----------------------+
| id | fname  | lname | address          | city   | state         | zip    | phone      | email                 |
+----+--------+-------+------------------+--------+---------------+--------+------------+-----------------------+
|  5 | Vedant | Jain  | sector 22 Bhopal | Bhopal | Madhyapradesh | 425107 | 7400441210 | VedantJain18gmail.com |
+----+--------+-------+------------------+--------+---------------+--------+------------+-----------------------+
1 row in set (0.00 sec)




___________________________________________________________________

	UC7  Size of address book data by city and state of contact.
___________________________________________________________________




mysql> select city ,count(city) from address_book where city = "mumbai" group by city;

+--------+-------------+
| city   | count(city) |
+--------+-------------+
| Mumbai |           3 |
+--------+-------------+
1 row in set (0.00 sec)


mysql> select state, count(state) from address_book where state = "maharashtra" group by state;

+-------------+--------------+
| state       | count(state) |
+-------------+--------------+
| Maharashtra |            4 |
+-------------+--------------+
1 row in set (0.00 sec)



___________________________________________________________________

	UC8  Alphabetically sort the  address book data by name.
___________________________________________________________________



mysql> select * from address_book order by fname ASC;
+----+---------+-----------+------------------+--------+---------------+--------+------------+-----------------------------+
| id | fname   | lname     | address          | city   | state         | zip    | phone      | email                       |
+----+---------+-----------+------------------+--------+---------------+--------+------------+-----------------------------+
|  3 | Sayali  | Kurhade   | Nerul            | Mumbai | Maharashtra   | 425405 | 9910120019 | SayaliKurhade20gmail.com    |
|  2 | Tushar  | Jadhav    | Asalfa           | Mumbai | Maharashtra   | 421078 | 9400121022 | tusharjadhav21gmail.com     |
|  4 | Vaibhav | Kumbhar   | Govandi          | Mumbai | Maharashtra   | 425210 | 9910124214 | VaibhavKumbhar19gmail.com   |
|  1 | Vedant  | Gujarathi | Gujarathi Lane   | Chopda | Maharashtra   | 425107 | 9145526100 | vedantgujarathi22@gmail.com |
|  5 | Vedant  | Jain      | sector 22 Bhopal | Bhopal | Madhyapradesh | 425107 | 7400441210 | VedantJain18gmail.com       |
+----+---------+-----------+------------------+--------+---------------+--------+------------+-----------------------------+
5 rows in set (0.00 sec)



___________________________________________________________________

	UC9  Ability to identify address_book by name and type.
___________________________________________________________________



mysql> update address_book set type = "Family" where fname = "Vedant" and city = "Chopda";
Query OK, 1 row affected (0.01 sec)
Rows matched: 1  Changed: 1  Warnings: 0


mysql> Update address_book set type = "Friend" where fname = "Vaibhav" or fname = "Tushar";
Query OK, 2 rows affected (0.01 sec)
Rows matched: 2  Changed: 2  Warnings: 0


mysql> Update address_book set type = "Profession" where fname = "Sayali";
Query OK, 1 row affected (0.04 sec)
Rows matched: 1  Changed: 1  Warnings: 0


mysql> update address_book set type = "Friend" where fname = "Vedant" and city = "Bhopal";
Query OK, 1 row affected (0.04 sec)
Rows matched: 1  Changed: 1  Warnings: 0


mysql> select * from address_book;

+----+---------+-----------+------------------+--------+---------------+--------+------------+-----------------------------+------------+
| id | fname   | lname     | address          | city   | state         | zip    | phone      | email                       | type       |
+----+---------+-----------+------------------+--------+---------------+--------+------------+-----------------------------+------------+
|  1 | Vedant  | Gujarathi | Gujarathi Lane   | Chopda | Maharashtra   | 425107 | 9145526100 | vedantgujarathi22@gmail.com | Family     |
|  2 | Tushar  | Jadhav    | Asalfa           | Mumbai | Maharashtra   | 421078 | 9400121022 | tusharjadhav21gmail.com     | Friend     |
|  3 | Sayali  | Kurhade   | Nerul            | Mumbai | Maharashtra   | 425405 | 9910120019 | SayaliKurhade20gmail.com    | Profession |
|  4 | Vaibhav | Kumbhar   | Govandi          | Mumbai | Maharashtra   | 425210 | 9910124214 | VaibhavKumbhar19gmail.com   | Friend     |
|  5 | Vedant  | Jain      | sector 22 Bhopal | Bhopal | Madhyapradesh | 425107 | 7400441210 | VedantJain18gmail.com       | Friend     |
+----+---------+-----------+------------------+--------+---------------+--------+------------+-----------------------------+------------+
5 rows in set (0.00 sec)